{"artifact_commit":"b95add1257d9ae1af5bd268b6af63a226b05ca3b","artifact_digests":{"command_results":{"digest":"sha256:f67c104bdea5aa71abc5877900d0c642df71d1d5c05e986df8364c48cbbc15af","path":"docs/superpowers/evidence/post-integration/post-integration-command-results.json"},"context":{"digest":"sha256:a8f0d4ccdd1351b6215a2871e15dbcae718d96fa816e8770d7ca5cadf996d2ee","path":"docs/superpowers/evidence/post-integration/post-integration-context.json"},"entry_manifest":{"digest":"sha256:a0d1ffedc8fb15dfc209d9c6d14b518e3d567183a047f05aa8df57074bd20bd7","path":"docs/superpowers/evidence/post-integration/post-integration-entry-baseline.json"},"handoff":{"digest":"sha256:aaa190ccb5f187e73de2efb8f11a35f4d9621f841a74645a5e42a1ab7e31ac43","path":"docs/superpowers/evidence/post-integration/post-integration-handoff.json"}},"command_results_digest":"sha256:f67c104bdea5aa71abc5877900d0c642df71d1d5c05e986df8364c48cbbc15af","compatibility_policy":"phase_0_additive_only_breaking_requires_new_version_and_migration_test","context_digest":"sha256:a8f0d4ccdd1351b6215a2871e15dbcae718d96fa816e8770d7ca5cadf996d2ee","destruction_procedure":"git_revert_artifact_commit_after_security_approval","disabled_capabilities":["real_upstream_access","real_credentials","provider_internal_authority","profile_promotion","production_deployment","real_canary","direct_egress_trust","unverified_pinned_wire_claims","unsupported_negative_capabilities","expired_or_missing_negative_capabilities"],"entry_manifest_digest":"sha256:a0d1ffedc8fb15dfc209d9c6d14b518e3d567183a047f05aa8df57074bd20bd7","generated_at":"2026-07-12T15:36:30.265Z","handoff_digest":"sha256:aaa190ccb5f187e73de2efb8f11a35f4d9621f841a74645a5e42a1ab7e31ac43","next_phase_gates":["phase_0_exit_receipt_valid","fresh_baseline_and_context_required","b1_b6_and_ha_p0_009_remain_non_promotable","real_upstream_credentials_promotion_and_deploy_disabled","named_owner_and_gate_approval_required"],"phase_zero_exit_receipt_digest":"sha256:5a2bef840e04d6533bfc657520c73cbc8fcc5f27ede181d168d9b2bf8a3fedee","receipt_kind":"post_integration_receipt","redaction_policy":"digests_and_safe_redacted_excerpts_only","repositories":[{"commit":"414c520f1e06120275c0b4a2f9c6879ba640604e","name":"cc_gateway","remote_ref":"refs/remotes/muqihang/main"},{"commit":"d5a42bbd24d15af2ce7646d050a5ae5c77911d4f","name":"sub2api","remote_ref":"refs/remotes/muqihang/main"}],"retention_class":"phase_evidence_permanent","reviewed_tool_head":"cb9019edfbb5ae548fe2550fa673fea9ddfca747","schema_version":1}
