{"artifact_commit":"cc9eea4846a50f385799835ae63e05bb921173f1","artifact_digests":{"command_results":{"digest":"sha256:b25a50071bf0062ad31c963e15154066ff0fe9963bf9cd66a5c8a0675d1f2e9b","path":"docs/superpowers/evidence/post-integration-v2/post-integration-command-results.json"},"context":{"digest":"sha256:6a3b9594cdf9dddd080325ff85b58ef988c733b8e186e5a66b87d118ec05f84f","path":"docs/superpowers/evidence/post-integration-v2/post-integration-context.json"},"entry_manifest":{"digest":"sha256:7670881a6a1d311a1fc47d9be3f7612ed082ebc6a60ccbc89ce100dbae54cb81","path":"docs/superpowers/evidence/post-integration-v2/post-integration-entry-baseline.json"},"handoff":{"digest":"sha256:f44619b955808805aed20d61c3fdd39ba96029750b6c8cd73db826b7574c8ba2","path":"docs/superpowers/evidence/post-integration-v2/post-integration-handoff.json"}},"command_results_digest":"sha256:b25a50071bf0062ad31c963e15154066ff0fe9963bf9cd66a5c8a0675d1f2e9b","compatibility_policy":"phase_0_additive_only_breaking_requires_new_version_and_migration_test","context_digest":"sha256:6a3b9594cdf9dddd080325ff85b58ef988c733b8e186e5a66b87d118ec05f84f","destruction_procedure":"git_revert_artifact_commit_after_security_approval","disabled_capabilities":["real_upstream_access","real_credentials","provider_internal_authority","profile_promotion","production_deployment","real_canary","direct_egress_trust","unverified_pinned_wire_claims","unsupported_negative_capabilities","expired_or_missing_negative_capabilities"],"entry_manifest_digest":"sha256:7670881a6a1d311a1fc47d9be3f7612ed082ebc6a60ccbc89ce100dbae54cb81","generated_at":"2026-07-12T17:08:01.033Z","handoff_digest":"sha256:f44619b955808805aed20d61c3fdd39ba96029750b6c8cd73db826b7574c8ba2","next_phase_gates":["phase_0_exit_receipt_valid","fresh_baseline_and_context_required","b1_b6_and_ha_p0_009_remain_non_promotable","real_upstream_credentials_promotion_and_deploy_disabled","named_owner_and_gate_approval_required"],"phase_zero_exit_receipt_digest":"sha256:5a2bef840e04d6533bfc657520c73cbc8fcc5f27ede181d168d9b2bf8a3fedee","receipt_kind":"post_integration_receipt","redaction_policy":"digests_and_safe_redacted_excerpts_only","repositories":[{"commit":"b38198763ab7e337321e3a0d9e545375d3fb3ad0","name":"cc_gateway","remote_ref":"refs/remotes/muqihang/main"},{"commit":"d5a42bbd24d15af2ce7646d050a5ae5c77911d4f","name":"sub2api","remote_ref":"refs/remotes/muqihang/main"}],"retention_class":"phase_evidence_permanent","reviewed_tool_head":"d20ef998c938540e07c95abbe71560262711b439","schema_version":1}
